{
  "$schema": "https://json-schema.org/draft/2020-12/schema",
  "$id": "https://gallformers.org/schemas/import/v3/schema/taxonomy.schema.json",
  "title": "Gallformers import — taxonomy batch",
  "description": "Taxonomic acts a Source states: names, placements, synonymies, splits. Galls go in the gall batch. Acts concern plant taxa only when the plant itself forms galls. Written for every Source: empty taxa and acts mean the Source states no taxonomic acts.",
  "type": "object",
  "allOf": [{ "$ref": "common.schema.json#/$defs/envelope" }],
  "required": ["batch_type", "taxa", "acts"],
  "properties": {
    "format": true, "format_version": true, "vocabulary_version": true, "mode": true,
    "batch_id": true, "produced_at": true, "producer": true, "source": true,
    "batch_type": { "const": "taxonomy" },
    "taxa": {
      "type": "array",
      "items": { "$ref": "common.schema.json#/$defs/taxon_ref" },
      "description": "Every taxon the acts mention, declared once. Empty when acts is empty."
    },
    "acts": {
      "type": "array",
      "items": { "$ref": "#/$defs/act" },
      "description": "The taxonomic acts the Source states. Empty when it states none, or on a retraction notice that carries none."
    },
    "unmapped": { "$ref": "common.schema.json#/$defs/unmapped" }
  },
  "unevaluatedProperties": false,

  "$defs": {
    "act": {
      "description": "A taxonomic act; its kind decides its fields.",
      "type": "object",
      "required": ["kind"],
      "properties": {
        "kind": { "enum": ["name", "placement", "synonymy", "split", "common_name"] }
      },
      "allOf": [
        { "if": { "properties": { "kind": { "const": "name" } } }, "then": { "$ref": "#/$defs/name_act" } },
        { "if": { "properties": { "kind": { "const": "placement" } } }, "then": { "$ref": "#/$defs/placement_act" } },
        { "if": { "properties": { "kind": { "const": "synonymy" } } }, "then": { "$ref": "#/$defs/synonymy_act" } },
        { "if": { "properties": { "kind": { "const": "split" } } }, "then": { "$ref": "#/$defs/split_act" } },
        { "if": { "properties": { "kind": { "const": "common_name" } } }, "then": { "$ref": "#/$defs/common_name_act" } }
      ]
    },

    "act_base": {
      "type": "object",
      "required": ["id", "stance", "kind", "evidence"],
      "properties": {
        "id": { "$ref": "common.schema.json#/$defs/act_id" },
        "stance": { "$ref": "common.schema.json#/$defs/stance" },
        "evidence": { "$ref": "common.schema.json#/$defs/evidence" },
        "status_as_written": {
          "type": "string",
          "minLength": 1,
          "description": "Optional. The Source's own status words for this act, as written: 'syn. nov.' (this Source makes the synonymy), 'stat. rev.', 'incorrect spelling', 'nomen dubium', 'combination by Smith (1900)'. Free text."
        }
      }
    },

    "name_act": {
      "description": "The taxon exists with this name and rank, with this authorship. Combined with taxa[].new, the Source's description of a new taxon or new combination.",
      "allOf": [{ "$ref": "#/$defs/act_base" }],
      "required": ["taxon"],
      "properties": {
        "kind": { "const": "name" },
        "taxon": { "$ref": "common.schema.json#/$defs/taxon_ref_id" },
        "authorship": {
          "type": "object",
          "required": ["as_written"],
          "properties": {
            "as_written": { "type": "string", "minLength": 1, "description": "Exactly as written, e.g. '(Ashmead, 1881)'." }
          },
          "additionalProperties": false
        }
      },
      "unevaluatedProperties": false
    },

    "placement_act": {
      "description": "The taxon sits under this parent. A move is a placement under the new parent. A new intermediate rank is a name act plus placements.",
      "allOf": [{ "$ref": "#/$defs/act_base" }],
      "required": ["taxon", "parent"],
      "properties": {
        "kind": { "const": "placement" },
        "taxon": { "$ref": "common.schema.json#/$defs/taxon_ref_id" },
        "parent": { "$ref": "common.schema.json#/$defs/taxon_ref_id" }
      },
      "unevaluatedProperties": false
    },

    "synonymy_act": {
      "description": "name is a synonym of accepted. A lump is several synonymy acts. A recombination is a placement, the new combination's name act, and the old combination as a synonym.",
      "allOf": [{ "$ref": "#/$defs/act_base" }],
      "required": ["name", "accepted"],
      "properties": {
        "kind": { "const": "synonymy" },
        "name": { "$ref": "common.schema.json#/$defs/taxon_ref_id" },
        "accepted": { "$ref": "common.schema.json#/$defs/taxon_ref_id" }
      },
      "unevaluatedProperties": false
    },

    "split_act": {
      "description": "The taxon was divided into these taxa. It states the division only.",
      "allOf": [{ "$ref": "#/$defs/act_base" }],
      "required": ["taxon", "into"],
      "properties": {
        "kind": { "const": "split" },
        "taxon": { "$ref": "common.schema.json#/$defs/taxon_ref_id" },
        "into": {
          "type": "array",
          "minItems": 2,
          "uniqueItems": true,
          "items": { "$ref": "common.schema.json#/$defs/taxon_ref_id" }
        }
      },
      "unevaluatedProperties": false
    },

    "common_name_act": {
      "description": "A common name of the organism, as written (e.g. 'Poplar vagabond aphid'). Common names of Galls are alias Facts in the gall batch.",
      "allOf": [{ "$ref": "#/$defs/act_base" }],
      "required": ["taxon", "common_name"],
      "properties": {
        "kind": { "const": "common_name" },
        "taxon": { "$ref": "common.schema.json#/$defs/taxon_ref_id" },
        "common_name": { "type": "string", "minLength": 1 }
      },
      "unevaluatedProperties": false
    }
  }
}
