{
  "format": "gallformers-import",
  "format_version": 3,
  "vocabulary_version": "2026-10-11",
  "batch_type": "taxonomy",
  "mode": "replace",
  "batch_id": "0b5e3a52-6d0f-4c41-9d6e-1f2a3b4c5d06",
  "produced_at": "2026-10-07T14:00:00Z",
  "producer": { "name": "example", "version": "0.0.1", "model": "example-model", "instructions_version": "2026-10-07" },

  "source": {
    "kind": "publication",
    "title": "Galls of the Example Hills",
    "authors": ["Example, A.", "Sample, B."],
    "authored": { "date": "2024", "as_written": "2024" },
    "citation": "Example, A. & Sample, B. 2024. Galls of the Example Hills. Journal of Examples 12: 50-70.",
    "identifiers": { "doi": "10.0000/example.2024.12" },
    "license": { "value": "CC-BY", "as_written": "This article is distributed under CC BY 4.0" },
    "document": { "file": "document.json", "sha256": "7b392751151d599627f28742bc07cae7bda55f45dbaec5c1378240a07cd758f2" }
  },

  "taxa": [],
  "acts": []
}
